PDF Bestandsnaam,Domein,Vraag
2025I.pdf,Waarnemen,Leg uit dat de zeearend ernstige gezondheidsschade ondervindt van deze insecticiden
2025I.pdf,Waarnemen,Bepaal de insecticiden zoals het verboden middel DDT zijn een grote bedreiging voor de gezondheid
2025I.pdf,Waarnemen,gevoelig zijn voor het gif als zeearenden
2025I.pdf,Waarnemen,De duiker kan hierdoor echter buiten bewustzijn raken voordat de ademprikkel ontstaat en kan zo verdrinken
2025I.pdf,Waarnemen,De grootte van de milt wordt alleen bepaald door het gen op chromosoom
2025I.pdf,Waarnemen,lees verder Insecticiden worden in de landbouw gebruikt om insecten te doden die voedselgewassen aantasten
2025I.pdf,Erfelijkheid,Resistentie van een schimmel tegen een medicijn kan ontstaan na herhaald gebruik van dit medicijn
2025I.pdf,Erfelijkheid,Het mutante allel is recessief
2025I.pdf,Erfelijkheid,Bij Eileen is FA het gevolg van autosomale overerving
2025I.pdf,Erfelijkheid,Leg uit hoe deze twee celtypen samen tegengaan dat schimmelsporen de plant infecteren
2025I.pdf,Erfelijkheid,Zo kunnen onderzoekers inzicht krijgen in paarvorming en migratie van deze vogels
2025I.pdf,Erfelijkheid,De broedpogingen van de zeearend zijn niet altijd succesvol
2025I.pdf,Erfelijkheid,Bij het ringen wordt het geslacht van de jonge zeearend bepaald
2025I.pdf,Erfelijkheid,de eerste base de tweede base de derde base
2025I.pdf,Erfelijkheid,Normaal gesproken regelt het FANCA gen dat DNA gerepareerd kan worden
2025I.pdf,Erfelijkheid,ig is in een gen op het X chromosoom
2025I.pdf,Erfelijkheid,l is recessief
2025I.pdf,Erfelijkheid,oekers isoleerden het DNA uit cellen van het wangslijmvlies
2025I.pdf,Erfelijkheid,afbeelding Op een van de tekeningen in afbeelding is te zien dat de schimmel het gebied heeft geïnfecteerd dat Jaspers rechterhand aanstuurt
2025I.pdf,Erfelijkheid,leerlingen doen mee aan het onderzoek
2025I.pdf,Erfelijkheid,g is van deze extra puddingen
2025I.pdf,Erfelijkheid,s teksten en afbeeldingen is te vinden in het bij dit examen
2025I.pdf,Erfelijkheid,Om dit tegen te gaan is een donor gezocht
2025I.pdf,Erfelijkheid,Welk gas wordt netto opgenomen in het licht
2025I.pdf,Erfelijkheid,En welk gas wordt netto opgenomen in het donker
2025I.pdf,Erfelijkheid,De nakomelingen zijn genetisch
2025I.pdf,Erfelijkheid,Recombinatie van de chromosomen is mogelijk
2025I.pdf,Erfelijkheid,afbeelding Het water in de bakken bevat onder andere anorganische stikstofverbindingen
2025I.pdf,Erfelijkheid,Enkele organische stoffen zijn chlorofyl DNA
2025I.pdf,Erfelijkheid,afbeelding afbeelding Zeearenden werden al eerder in Nederland waargenomen maar pas vanaf vestigden ze zich
2025I.pdf,Bloedsomloop,De duiker raakt buiten bewustzijn doordat de O2 concentratie in zijn bloed te laag wordt
2025I.pdf,Bloedsomloop,Umami hartig is de vijfde smaak die mensen kunnen onderscheiden
2025I.pdf,Bloedsomloop,waardoor er onder andere een verminderde aanmaak is van de vaste bloedbestanddelen
2025I.pdf,Bloedsomloop,Eileens vader heeft geen FA
2025I.pdf,Bloedsomloop,Daardoor is ze altijd moe en heeft ze vaak last van infecties en bloedingen
2025I.pdf,Bloedsomloop,Afbeelding is een microscopisch preparaat van gezond bloed
2025I.pdf,Bloedsomloop,Hierin zijn verschillende vaste bloedbestanddelen met nummers aangegeven
2025I.pdf,Bloedsomloop,afbeelding lees verder De milt kan rode bloedcellen opslaan en speelt een rol bij de afbraak ervan
2025I.pdf,Bloedsomloop,In welk ander orgaan worden rode bloedcellen afgebroken
2025I.pdf,Bloedsomloop,Noteer in de tweede kolom in elk vakje het nummer waarmee het bijbehorende bloedbestanddeel in afbeelding is aangegeven
2025I.pdf,Bloedsomloop,de rode bloedcellen zijn bij voorkeur van Eileens eigen bloedgroep
2025I.pdf,Bloedsomloop,Eileen heeft bloedgroep B en is resuspositief
2025I.pdf,Bloedsomloop,ou ze ook rode bloedcellen van andere bloedgroepen kunnen ontvangen
2025I.pdf,Bloedsomloop,Het ziekenhuis heeft de volgende andere rode bloedcellen op voorraad
2025I.pdf,Bloedsomloop,n op voorraad Noteer welke van deze rode bloedcellen
2025I.pdf,Bloedsomloop,slagader lees verder Jasper kreeg antischimmel medicijnen
2025I.pdf,Bloedsomloop,Wat is de naam van het proces waarbij uit de stamcellen verschillende typen bloedcellen ontstaan
2025I.pdf,Bloedsomloop,typen bloedcellen dat is het ontstaan door gevolg van adaptatie sie adaptatie recombinatie differentiatie
2025I.pdf,Bloedsomloop,de stamcellen zich vestigen op de plaats waar ook bij gezonde mensen bloedc
2025I.pdf,Bloedsomloop,de stamcellen zich dan bij Eileen hebben in haar botten in haar hart in haar lev
2025I.pdf,Bloedsomloop,een juiste conclusie is op basis van de gegevens in het informatiekader
2025I.pdf,Afweer,lees verder Uit het onderzoek blijkt dat de milt bij de Baja u mannen gemiddeld groter is dan bij de Saluan mannen
2025I.pdf,Afweer,Uit dit onderzoek is niet af te leiden of een grotere milt erfelijk is of dat
2025I.pdf,Afweer,Om dat te bepalen moet in een vervolgonderzoek de miltgrootte van twee andere groepen met elkaar vergeleken worden
2025I.pdf,Afweer,Noteer twee groepen waarvan de milt grootte met elkaar moet worden vergeleken om hier duidelijkheid over te krijgen
2025I.pdf,Afweer,erzoek waaruit blijkt dat een grotere milt erfelijk is
2025I.pdf,Afweer,Beschrijf hoe evolutie tot een grotere milt kan hebben geleid
2025I.pdf,Afweer,honden is bekend dat er een relatie is tussen de grootte van de milt en de maximale duik tijd
2025I.pdf,Afweer,stoftekort kan de milt samentrekken om extra rode bloedcellen vrij te laten
2025I.pdf,Afweer,capaciteit van de Bajau ook een relatie heeft met de grootte van hun milt en of deze aanpassing een genetische basis heeft
2025I.pdf,Afweer,Met behulp van echografie bepaald en ze de grootte van de milt
2025I.pdf,Afweer,Cellen van de milt zijn moeilijk af te nemen
2025I.pdf,Afweer,De milt is onderdeel van het lymfestelsel
2025I.pdf,Afweer,Met echografie werd de grootte van de milt bepaald
2025I.pdf,Afweer,De transducer van het echoapparaat wordt op de plaats op de romp gezet waar zich de milt bevindt
2025I.pdf,Afweer,Op een beeldscherm kan de milt dan zichtbaar worden gemaakt
2025I.pdf,Afweer,st worden om een beeld van de milt te kunnen krijgen
2025I.pdf,Afweer,e infectie gehad met een schimmel die resistent is tegen medicijnen
2025I.pdf,Stofwisseling van de cel,Artsen vermoeden dat patiënten de ziekte oplopen door het inademen van resistente schimmelsporen uit het milieu
2025I.pdf,Stofwisseling van de cel,In de periode van mei tot oktober groeit de populatie Als het wateroppervlak geheel met eendenkroos bedekt is kan een tekort aan zuurstof ontstaan
2025I.pdf,Stofwisseling van de cel,Noteer de nummers van de vier gebeurtenissen waardoor een tekort aan zuurstof ontstaat in de juiste volgorde
2025I.pdf,Stofwisseling van de cel,Er is geen fotosynthese mogelijk bij waterplanten die onder water groeien
2025I.pdf,Stofwisseling van de cel,es spelen een aantal gebeurtenissen een rol Aerobe bacteriën breken het organisch materiaal af
2025I.pdf,Voeding en vertering,Welk enzym is nodig voor de afbraak van zetmeel
2025I.pdf,Voeding en vertering,De schimmel in de longen en hersenen van Jasper bleek resistent tegen azolen door een puntmutatie in het gen voor het enzym
2025I.pdf,Voeding en vertering,Daardoor heeft het enzym een iets andere vorm met als gevolg dat azolen dit enzym niet meer kunnen remmen
2025I.pdf,Voeding en vertering,Ondanks de andere vorm is het enzym nog wel werkzaam
2025I.pdf,Voeding en vertering,he stoffen organische stoffen reducenten organische stoffen anorganische stoffen scheidt amylase uit
2025I.pdf,Voeding en vertering,enzym is nodig voor
2025I.pdf,Voeding en vertering,ntlasting terechtkomt Er is nog een belangrijke oorzaak van dit energieverlies
2025I.pdf,Voeding en vertering,Noteer die oorzaak
2025I.pdf,Voeding en vertering,Door het hoge eiwitgehalte
2025I.pdf,Voeding en vertering,De bloedmonsters werden onderzocht op het gehalte aan essentiële aminozuren
2025I.pdf,Voeding en vertering,Leg uit dat voor het bepalen
2025I.pdf,Voeding en vertering,van de vertering van eiwitten
2025I.pdf,Uitscheiding,Noteer welk onderzoek werd gedaan aan het huidmonster om het geslacht van de zeearend te bepalen
2025I.pdf,Uitscheiding,Welk gedeelte van een niereenheid zal zijn aangetast waardoor een kaliumtekort kan optreden
2025I.pdf,Uitscheiding,Maar door de hoge dosering van de medicijnen liepen Jaspers nieren schade op
2025I.pdf,Uitscheiding,oor hun profielwerkstuk onderzoeken of de smaakstoffen van ham en van kaas elkaar op dezelfde manier versterken als spek
2025I.pdf,Uitscheiding,Om te controleren of de proefpersonen wel in staat zijn om ham en kaassmaak waar te nemen lat en Han en Kees hun proefperso
2025I.pdf,Zenuwstelsel en hormonen,Wetenschappers denken dat het samentrekken van de milt aan het begin van een duik wordt veroorzaakt door signalen van het zenuwstelsel
2025I.pdf,Zenuwstelsel en hormonen,Welk deel van het zenuwstelsel is dat
2025I.pdf,Zenuwstelsel en hormonen,In welk deel van de hersenen wordt de smaak waargenomen
2025I.pdf,Zenuwstelsel en hormonen,lijk wordt waargenomen in de hersenen
2025I.pdf,Zenuwstelsel en hormonen,el sel het parasympathisch zenuwstelsel het orthosympathisch zenuwstelsel lees verder Als er jonge zeearenden uit het ei
2025I.pdf,Zenuwstelsel en hormonen,De ademprikkel blijft uit omdat de CO2 concentratie in het bloed hoog is
2025I.pdf,Zenuwstelsel en hormonen,Demper prikkel blijft uit omdat de CO concentratie in het bloe d hoog is
2025I.pdf,Zenuwstelsel en hormonen,erecht Dit leidt tot het ontstaan van in de zenuwc
2025I.pdf,Zenuwstelsel en hormonen,Op twee plaatsen ontbreekt een woord
2025I.pdf,Zenuwstelsel en hormonen,Noteer in de cirkels een voor een stimulerend effect en voor een remmend effect
2025I.pdf,Zenuwstelsel en hormonen,De zenuwcellen in de neus reageren op geurstoffen
2025I.pdf,Plantenfysiologie,bladgroenkorrels celkern Welke van deze onderdelen zijn aanwezig bij een schimmelcel
2025I.pdf,Plantenfysiologie,De plantjes bestaan uit een bladachtig schijfje dat op het water drijft
2025I.pdf,Plantenfysiologie,Eendenkroos groeit op ondiep stilst aand of langzaam stromend water in sloten en vijvers
2025I.pdf,Plantenfysiologie,lees verder Eendenkroos groeit op ondiep stilst aand of langzaam stromend water in sloten en vijvers
2025I.pdf,Plantenfysiologie,Deze azolen komen met plantenafval terecht op composthopen
2025I.pdf,Plantenfysiologie,Waar zullen de getransplanteerde
2025I.pdf,Ademhaling,Om lang zijn adem in te kunnen houden kan een duiker vooraf een aantal keer diep in en uitademen
2025I.pdf,Ademhaling,Door het inhouden van de adem wordt het restvolume van de longen groter
2025I.pdf,Ecologie,De populatie is gegroeid tot ruim dieren
2025I.pdf,Ecologie,ecosysteem populatie trofisch niveau De zeearend is in Nederland geen exoot
2025I.pdf,Beweging,Methode onderzoekers meten de breedte en dikte van een bepaald bot in de poot
2025I bijlage.pdf,Bloedsomloop,nummer in afbeeldin mptoom bi tekort rode bloedcel witte bloedcel wel smaakwaarnemin een smaakwaarne
2025I bijlage.pdf,Onbekend,Naam kandidaat
2025II.pdf,Ademhaling,lees verder De ademhaling wordt automatisch geregeld door het adem centrum
2025II.pdf,Ademhaling,Zijn huisarts vermoedt het post covidsyndroom long covid
2025II.pdf,Ademhaling,Als er minder longblaasjes zijn wordt een andere factor uit de formule kleiner
2025II.pdf,Ademhaling,ctor is kleiner al s er minder longblaas
2025II.pdf,Afweer,virus aanwezig zijn
2025II.pdf,Bloedsomloop,afbeelding Zonnedauw is een groep van vlees etende planten met groene bladeren en bladeren met kleverige druppels
2025II.pdf,Bloedsomloop,Ze heeft al twee hartoperaties gehad
2025II.pdf,Bloedsomloop,De hartafwijking van Britt is al vroeg tijdens de embryonale ontwikkeling ontstaan
2025II.pdf,Bloedsomloop,afbeelding In de tekst worden drie verschil len genoemd ten opzichte van een normaal gebouwd hart
2025II.pdf,Bloedsomloop,De hartchirurg heeft toen de wand v
2025II.pdf,Bloedsomloop,In afbeelding is een schematische tekening van het hart van Britt te zien
2025II.pdf,Bloedsomloop,In afbeelding zijn de hartkleppen met nummers aangegeven
2025II.pdf,Bloedsomloop,Noteer de nummers van de hartkleppen die bij de rechterboezem horen
2025II.pdf,Bloedsomloop,In afbeelding is een schematische tekening van de bloedsomloop te zien
2025II.pdf,Bloedsomloop,Noteer de letter van de bloedvaten waarin het zuurstofgehalte van het bloed het hoogst is
2025II.pdf,Bloedsomloop,Noteer de letter van de bloedvaten waarin het zuurstofgehalte van het bloed het laagst is
2025II.pdf,Bloedsomloop,In afbeelding is een schematische tekening van de bloedsomloop van Britt te zien
2025II.pdf,Bloedsomloop,Noteer de letter van het bloedvat waarin het zuurstofgehalte van het bloed het hoogst is
2025II.pdf,Bloedsomloop,Noteer de letter van het bloedvat waarin het zuurstofgehalte van het bloed het laagst is
2025II.pdf,Bloedsomloop,De bloeddruk in de longslagader is hoger dan normaal
2025II.pdf,Erfelijkheid,Onderzoekers in Zweden deden onderzoe naar de invloed van stikstofverbindingen in de bodem op de igheid van zon nedauw
2025II.pdf,Erfelijkheid,Deze zijn onderverdeeld in verschillende geslacht en genera
2025II.pdf,Erfelijkheid,In tegenstelling tot pulp is het sap lang houdbaar
2025II.pdf,Erfelijkheid,ng is ze sneller moe dan haar leeftijdsgenoten
2025II.pdf,Erfelijkheid,arth na s hebben dezelfde uiterst compl xe mutatie aan het EDN gen
2025II.pdf,Erfelijkheid,Deze mutatie zorgt ervoor dat de bloeddruk in de longslagader hoger is dan normaal
2025II.pdf,Erfelijkheid,Deze mutatie is autosoom dominant
2025II.pdf,Erfelijkheid,Deze mutatie is autosoom recessief
2025II.pdf,Erfelijkheid,Deze mutatie is X chromosoom gebonden dominant
2025II.pdf,Erfelijkheid,Deze mutatie is X chromosoom gebonden recessief
2025II.pdf,Erfelijkheid,Deze mutatie is Y chromosoom gebonden
2025II.pdf,Erfelijkheid,Deze mutatie is mitochondrieel
2025II.pdf,Erfelijkheid,Deze mutatie is in het DNA van de chloroplasten
2025II.pdf,Erfelijkheid,Deze mutatie is in het DNA van de mitochondriën
2025II.pdf,Erfelijkheid,Deze mutatie is in het DNA van de kern
2025II.pdf,Erfelijkheid,Deze mutatie is in het DNA van de celkern
2025II.pdf,Stofwisseling van de cel,lees verder Het nadeel van het gebruik van verse suikerbieten is
2025II.pdf,Stofwisseling van de cel,De productie van sap uit suikerbieten kost echter veel meer energie waardoor deze manier van ethanol productie
2025II.pdf,Stofwisseling van de cel,Het nadeel van zo n operatie is
2025II.pdf,Stofwisseling van de cel,lees verder Ademtherapie bij long covid Jean heeft maanden nadat hij covid heeft gehad nog steeds last van kortademigheid
2025II.pdf,Stofwisseling van de cel,Kortademigheid kan ontstaan als de diffusiesnelheid van zuurstof van de lucht in de longblaasjes naar het bloed verandert
2025II.pdf,Stofwisseling van de cel,De diffusiesnelheid in de longblaasjes kun je bepalen met de onderstaande formule
2025II.pdf,Stofwisseling van de cel,Noteer de letter van de factor die kleiner wordt als er minder longblaasjes zijn
2025II.pdf,Stofwisseling van de cel,Noteer de letter van de factor die groter wordt als de wand van de longblaasjes dunner wordt
2025II.pdf,Stofwisseling van de cel,Noteer de letter van de factor die kleiner wordt als de wand van de longblaasjes dunner wordt
2025II.pdf,Stofwisseling van de cel,Noteer de letter van de factor die groter wordt als de diffusieafstand kleiner wordt
2025II.pdf,Uitscheiding,lees verder Bij een kat met chronisch nierfalen zijn
2025II.pdf,Uitscheiding,n te zien in een microscopisch preparaat van het nierweefsel
2025II.pdf,Uitscheiding,is een foto van een microscopisch preparaat van nierweefsel van een kat met chronisch nierfalen
2025II.pdf,Uitscheiding,kt van de niereenheid waar P en Q bij horen
2025II.pdf,Uitscheiding,Hieronder staat hoe de grote hoeveelheid ureum ontstaat
2025II.pdf,Uitscheiding,Noteer de nummers van de vier processen in de juiste volgorde
2025II.pdf,Uitscheiding,In afbeelding is een schematische tekening van het kapsel van Bowman met de glomerulus
2025II.pdf,Uitscheiding,Welke letter in afbeelding geeft het kapsel van Bowman aan
2025II.pdf,Uitscheiding,En op welke plaats in afbeelding is de doorsnede gemaakt van de niereenheid waar P en Q bij horen
2025II.pdf,Uitscheiding,Noteer de letter van de niereenheid waar P en Q bij horen
2025II.pdf,Uitscheiding,In afbeelding is een schematische tekening van een niereenheid te zien
2025II.pdf,Uitscheiding,Noteer de letter van de niereenheid waar de glomerulus bij hoort
2025II.pdf,Uitscheiding,Noteer de letter van de niereenheid waar de capsule van Bowman bij hoort
2025II.pdf,Uitscheiding,Noteer de letter van de niereenheid waar de proximale tubulus bij hoort
2025II.pdf,Uitscheiding,Noteer de letter van de niereenheid waar de lis van Henle bij hoort
2025II.pdf,Voeding en vertering,kapsel van Bowman plaats doorsnede letter P plaats letter P plaats letter Q plaats letter Q plaats Maureen geeft Rio voed
2025II.pdf,Voeding en vertering,Het eten van te veel eiwitten zou name lijk leiden tot de productie van veel ureum wat schadelijk is voor Rio
2025II.pdf,Voeding en vertering,Bij de vertering van de grote hoeveelhei
2025II.pdf,Voeding en vertering,eiwitten worden veel
2025II.pdf,Voeding en vertering,gevormd die daarna worden geresorbeerd in de darm
2025II.pdf,Voeding en vertering,Noteer de naam van het enzym dat eiwitten afbreekt
2025II.pdf,Voeding en vertering,Noteer de naam van het enzym dat koolhydraten afbreekt
2025II.pdf,Voeding en vertering,Noteer de naam van het enzym dat vetten afbreekt
2025II.pdf,Voeding en vertering,Noteer de naam van het orgaan waar de vertering van eiwitten begint
2025II.pdf,Voeding en vertering,Noteer de naam van het orgaan waar de vertering van koolhydraten begint
2025II.pdf,Voeding en vertering,Noteer de naam van het orgaan waar de vertering van vetten begint
2025II.pdf,Voeding en vertering,Noteer de naam van het orgaan waar de opname van voedingsstoffen plaatsvindt
2025II.pdf,Waarnemen,En op welke plaats in afbeelding is de doorsnede gemaa
2025II.pdf,Waarnemen,Een groot gedeelte hiervan wordt vervolgens afgebroken door de
2025II.pdf,Waarnemen,Noteer het woord dat op de bijbehorende plaats moet staan erachter
2025II.pdf,Waarnemen,e correctievoorschrift
2025II.pdf,Waarnemen,Kleine zonnedauw Drosera intermedia afbeelding is een plantje dat maximaal cm hoog wordt
2025II.pdf,Waarnemen,De bladeren van kleine zonnedauw zijn bedekt met tentakels
2025II.pdf,Waarnemen,Aan het uiteinde van de tentakels zitten druppels kleverige vloeistof
2025II.pdf,Waarnemen,Als een insect op een tentakel landt blijft het insect plakken
2025II.pdf,Waarnemen,De tentakels buigen zich dan naar het midden van het blad
2025II.pdf,Waarnemen,De druppels kleverige vloeistof van de tentakels aan de rand van het blad buigen zich ook naar het midden
2025II.pdf,Waarnemen,Het insect wordt hierdoor omhuld door een laagje vloeistof
2025II.pdf,Waarnemen,De vertering van het insect begint
2025II.pdf,Waarnemen,De voedingsstoffen worden opgenomen door het blad
2025II.pdf,Waarnemen,De plant groeit hierdoor beter
2025II.pdf,Waarnemen,De verspreiding van het pigment in de stervormige cellen wordt aangestuurd door het zenuwstelsel
2025II.pdf,Zenuwstelsel en hormonen,De verspreiding van het pigment in de stervormige cellen wordt aangestuurd door het zenuwstelsel
2025II.pdf,Zenuwstelsel en hormonen,Noteer een voordeel van aansturing door het zenuwstelsel
2025II.pdf,Zenuwstelsel en hormonen,De afbeelding hieronder is een lengtedoorsnede van de hersenen en een deel van het ruggenmerg
2025II.pdf,Plantenfysiologie,ers hebben er vier jaar lang in september en in juni het aantal plantjes zonnedauw per vierkante meter geteld
2025II.pdf,Plantenfysiologie,Er is verband tussen de toegediende hoeveelheid stikstof en het aantal plantjes van ronde zonnedauw
2025II.pdf,Ecologie,Verklaar aan de hand van een abiotische factor dat de
2025II.pdf,Beweging,Ook hun botten en spieren zijn zwaar
